{
  "$schema": "https://json-schema.org/draft/2020-12/schema",
  "title": "agent/1 — the discovery document at /.well-known/agent",
  "description": "Structural schema for agent/1. Necessary but not sufficient: the cross-field rules (every endpoint, the handshake and the frontdoor share the document's registrable domain; a priced capability requires a payment section; policies.humanApprovalFor names declared capabilities; capability ids are unique; auth and payment methods are unique) are enforced by validate() in vendor-agent.mjs. Keys prefixed x- are carried and never checked, at every level — the format's one extension convention.",
  "type": "object",
  "required": ["contract", "domain", "org", "accountable", "updated", "capabilities", "auth"],
  "properties": {
    "contract": { "const": "agent/1" },
    "domain": {
      "type": "string",
      "pattern": "^(?:[a-z0-9](?:[a-z0-9-]{0,61}[a-z0-9])?\\.)+[a-z][a-z0-9-]{0,61}[a-z0-9]$",
      "description": "The lowercase hostname this document is served from. No scheme, no path, no port. Every endpoint must share its registrable domain."
    },
    "org": {
      "type": "string",
      "pattern": "^org/[a-z0-9]+(-[a-z0-9]+)*$",
      "description": "The organisation's id in the estate id grammar: org/<slug>."
    },
    "accountable": { "$ref": "#/$defs/accountable" },
    "updated": {
      "type": "string",
      "pattern": "^\\d{4}-\\d{2}-\\d{2}$",
      "description": "ISO date the document was last changed."
    },
    "capabilities": {
      "type": "array",
      "minItems": 1,
      "items": { "$ref": "#/$defs/capability" },
      "description": "What an agent may DO here. Ids are unique (cross-field rule)."
    },
    "auth": {
      "type": "array",
      "minItems": 1,
      "items": { "$ref": "#/$defs/authMethod" },
      "description": "Authentication methods accepted. Required so that silence never reads as open; `none` is spelled out."
    },
    "payment": {
      "type": "array",
      "minItems": 1,
      "items": { "$ref": "#/$defs/paymentMethod" },
      "description": "Payment methods accepted. Required when any capability carries a price (cross-field rule)."
    },
    "policies": { "$ref": "#/$defs/policies" },
    "handshake": {
      "$ref": "#/$defs/httpsUrl",
      "description": "The organisation's own flashyos/1 handshake, if it publishes one. Same registrable domain (cross-field rule)."
    },
    "frontdoor": {
      "$ref": "#/$defs/httpsUrl",
      "description": "The organisation's own frontdoor/1 door, if it publishes one. Same registrable domain (cross-field rule)."
    }
  },
  "patternProperties": { "^x-": {} },
  "additionalProperties": false,
  "$defs": {
    "httpsUrl": {
      "type": "string",
      "pattern": "^https://[a-z0-9.-]+\\.[a-z][a-z0-9-]*(/|$)",
      "description": "An https URL with a DNS hostname. validate() additionally refuses userinfo and explicit ports."
    },
    "token": {
      "type": "string",
      "pattern": "^[a-z][a-z0-9-]*$"
    },
    "methodToken": {
      "type": "string",
      "pattern": "^[a-z][a-z0-9-]*(/[0-9]+)?$",
      "description": "A token, optionally naming a versioned standard such as delegation/1."
    },
    "currency": { "type": "string", "pattern": "^[A-Z]{3}$" },
    "price": {
      "type": "object",
      "required": ["amount", "currency"],
      "properties": {
        "amount": {
          "type": "integer",
          "minimum": 0,
          "description": "Whole minor units of the currency: 2500 is 25.00 in a two-decimal currency. Never a float, never a string."
        },
        "currency": { "$ref": "#/$defs/currency" },
        "per": { "type": "string", "minLength": 1, "description": "The unit priced: request, booking, minute." }
      },
      "patternProperties": { "^x-": {} },
      "additionalProperties": false
    },
    "accountable": {
      "type": "object",
      "required": ["name", "email"],
      "properties": {
        "name": { "type": "string", "pattern": "\\S", "description": "A person, not a role or a department." },
        "email": {
          "type": "string",
          "pattern": "^[^@\\s]+@[^@\\s.]+\\.[^@\\s]+$",
          "not": { "const": "you@example.com" },
          "description": "A mailbox a human reads. The template placeholder is refused."
        }
      },
      "patternProperties": { "^x-": {} },
      "additionalProperties": false
    },
    "capability": {
      "type": "object",
      "required": ["id", "endpoint", "schema"],
      "properties": {
        "id": {
          "allOf": [
            { "$ref": "#/$defs/token" },
            { "not": { "enum": ["sales", "marketing", "engineering", "operations", "support", "finance", "legal", "hr"] } }
          ],
          "description": "A lowercase verb-like token: quote, book, refund. Departments are refused by name."
        },
        "description": { "type": "string", "pattern": "\\S" },
        "method": { "enum": ["GET", "POST", "PUT", "PATCH", "DELETE"] },
        "endpoint": { "$ref": "#/$defs/httpsUrl", "description": "Where the action lives. https, on this document's registrable domain." },
        "schema": { "$ref": "#/$defs/httpsUrl", "description": "The request/response schema for this endpoint." },
        "price": { "$ref": "#/$defs/price" }
      },
      "patternProperties": { "^x-": {} },
      "additionalProperties": false
    },
    "authMethod": {
      "type": "object",
      "required": ["method"],
      "properties": {
        "method": { "$ref": "#/$defs/methodToken" },
        "issuer": { "$ref": "#/$defs/httpsUrl" },
        "scopes": { "type": "array", "items": { "type": "string", "pattern": "\\S" } },
        "detail": { "type": "string", "pattern": "\\S" }
      },
      "patternProperties": { "^x-": {} },
      "additionalProperties": false
    },
    "paymentMethod": {
      "type": "object",
      "required": ["method"],
      "properties": {
        "method": { "$ref": "#/$defs/methodToken" },
        "currencies": { "type": "array", "minItems": 1, "items": { "$ref": "#/$defs/currency" } },
        "terms": { "$ref": "#/$defs/httpsUrl" },
        "detail": { "type": "string", "pattern": "\\S" }
      },
      "patternProperties": { "^x-": {} },
      "additionalProperties": false
    },
    "policies": {
      "type": "object",
      "properties": {
        "rateLimit": {
          "type": "object",
          "required": ["requests", "per"],
          "properties": {
            "requests": { "type": "integer", "minimum": 1 },
            "per": { "enum": ["second", "minute", "hour", "day"] }
          },
          "patternProperties": { "^x-": {} },
          "additionalProperties": false
        },
        "jurisdictions": {
          "type": "array",
          "minItems": 1,
          "items": { "type": "string", "pattern": "^[A-Z]{2}$" },
          "description": "ISO 3166-1 alpha-2 codes of the jurisdictions served."
        },
        "humanApprovalAtOrAbove": { "$ref": "#/$defs/price", "description": "Above this amount a human on the serving side approves before execution." },
        "humanApprovalFor": {
          "type": "array",
          "items": { "$ref": "#/$defs/token" },
          "description": "Capability ids that always require human approval. Each must be declared (cross-field rule)."
        },
        "terms": { "$ref": "#/$defs/httpsUrl" }
      },
      "patternProperties": { "^x-": {} },
      "additionalProperties": false
    }
  }
}
