{
  "contract": "agent/1",
  "domain": "shop.example.co.uk",
  "org": "org/example-shop",
  "accountable": { "name": "Bob Example", "email": "bob@example.co.uk" },
  "updated": "2026-09-28",
  "capabilities": [
    {
      "id": "check-stock",
      "endpoint": "https://api.example.co.uk/v1/stock",
      "schema": "https://api.example.co.uk/v1/stock.schema.json"
    }
  ],
  "auth": [{ "method": "api-key" }]
}
